{
  "$schema": "../../schemas/intake.schema.json",
  "screenId": "BattleHUD",
  "tier": "C",
  "templateFamilyCandidate": "",
  "uiId": "BattleHUD",
  "sourceOfTruth": {
    "screenSpec": "assets/resources/ui-spec/screens/battle-hud-screen.json",
    "layout": "battle-hud-main",
    "skin": "battle-hud-default",
    "bundle": "battle_ui",
    "layer": "Game"
  },
  "canonicalReferences": [
    "ref://docs/UI品質參考圖/battle-hud.png"
  ],
  "riskZones": [
    "top-bar",
    "action-bar",
    "battle-log"
  ],
  "smokeRoute": "node tools_node/capture-ui-screens.js --target BattleHUD --outDir artifacts/ui-qa/battle-hud/runtime-smoke",
  "notes": "non-GeneralDetail battlefield family reuse validation",
  "generatedAt": "2026-04-08T03:28:00.197Z",
  "generatedBy": "tools_node/intake-ui-screen.js"
}
