{
  "$schema": "../../schemas/intake.schema.json",
  "screenId": "shop-main-screen",
  "tier": "C",
  "templateFamilyCandidate": "rail-list",
  "uiId": "ShopMain",
  "sourceOfTruth": {
    "screenSpec": "artifacts\\ui-source\\shop-main\\workflow-v1\\generated\\shop-main-screen.json",
    "layout": "shop-main-main",
    "skin": "shop-main-default",
    "bundle": "lobby_ui",
    "layer": "Game"
  },
  "canonicalReferences": [
    "artifacts\\ui-source\\shop-main\\workflow-v1\\generated\\shop-main-screen.recipe.json",
    "artifacts\\ui-source\\shop-main\\workflow-v1\\generated\\shop-main-screen.json",
    "docs/ui/UCUF-UI-template-blueprint.md"
  ],
  "riskZones": [
    "rail-list.header",
    "rail-list.tab-bar",
    "rail-list.item-grid",
    "rail-list.currency-bar",
    "rail-list.purchase-panel"
  ],
  "smokeRoute": "LobbyScene -> open ShopMain",
  "notes": "Auto-generated intake skeleton from recipe shop-main-screen; replace canonicalReferences/risk zones with proof-specific values before production handoff.",
  "generatedAt": "2026-04-15T15:24:52.103Z",
  "generatedBy": "GitHubCopilot"
}
